Date,Link,Heading,Body
'October 16th 2021',https://babylonbee.com/news/dont-understand-the-babylon-bees-jokes-here-are-10-of-them-explained,"Here Are 10 Babylon Bee Jokes Explained (Just In Case You Don't Get Them)",From the Atlantic to the Pacific, a lot of people all across the country don't understand Babylon Bee jokes. That's because we conservative Christians are bad at humor. We're nowhere near as funny as leftist humorists like Samantha Bee and Jimmy Kimmel. So, to make sure you understand the headlines at The Babylon Bee, we've included ten classic Bee articles here along with a helpful explanation.OK, here we go:EXPLANATION: The joke here is that AOC (who is dumb), accidentally strangled herself tying her shoes, which is a simple task for most humans, because she is so stupid. Hope this is helpful.EXPLANATION: The joke here is that Democrats called for flags to be flown at half-mast to grieve the death of General Soleimani. Get it? A terrorist died and Democrats were sad.EXPLANATION: This one is a joke that NBA players were wearing special lace collars to honor Ruth Bader Ginsburg, who had recently passed away. The humor derives from the fact that they are NBA players wearing lace collars, which is humorous.EXPLANATION: Actually, this one's about sports, and we aren't really into sports. So we don't understand this one. If you get it, please explain it to us in the comments.EXPLANATION: The joke here is that celebrities got in their yachts, sailed out west of Malibu, and spelled out "WE'RE ALL IN THIS TOGETHER" with said yachts. Because they are rich (and also stupid).EXPLANATION: Wait a minute, this is real news! This isn't one of ours! How'd this get in here? Wish we had thought of this one, though.EXPLANATION: The joke here is that Bernie tested negative for president, because he is not the president. And also is a dumb socialist.EXPLANATION: Ah, nostalgia! A joke back from when The Babylon Bee told Christian jokes. The joke here is that Joel Osteen sailed his yacht through flooded Houston to hand out copies of his book Your Best Life Now, rather than offering help to those in need. Classic!EXPLANATION: The joke here is that a motorcyclist identified as a bicyclist and subsequently set a cycling world record. Because motorcycles are faster than bicycles.EXPLANATION: The joke here is that a grown man identified as a six-year-old... hey, wait a minute! That's the same joke! Get new material, Bee!We hope you found this helpful. If you liked these jokes, preorder our new book, The Babylon Bee Guide to Wokeness. It is jam-packed with over two jokes!
'October 16th 2021',https://babylonbee.com/news/pete-buttigieg-says-he-cannot-come-into-work-as-he-is-on-breastfeeding-duty,"Pete Buttigieg Says He Cannot Come Into Work As He Is On Breastfeeding Duty",WASHINGTON, D.C.—With catastrophic labor shortages and port congestion bringing America's supply chain to its knees, many are wondering if Transportation Secretary and new mother Pete Buttigieg will ever go back to work and address the problem."I would totally come back to work," said Buttigieg as he held his new baby, "but I need to take my paternity leave followed by several more months of maternity leave. Plus, as the twins' mother, I drew the short straw and got breastfeeding duty! These babies are keeping me up all hours of the night to breastfeed!"Buttigieg also cited his need for extended bed rest following a difficult labor. "It really did a number on me," he said. "I'm still so tired and hormonal, and those varicose veins and stretch marks! So many stretch marks!"Sources later confirmed the varicose veins and stretch marks were unrelated to the new babies. The Buttigieg's confirmed they are supplementing with infant formula since breastfeeding has proven difficult. "We thought there might have been a problem when the babies started losing a ton of weight. Thankfully, our house servant María told us about baby formula which really helps!"Buttigieg has suggested in the meantime that port authorities employ the help of Theodore Tugboat and get some bigger choo-choo trains to help clear the supply chain backlog. 
'October 16th 2021',https://babylonbee.com/news/instead-of-kryptonite-new-lgbtq-superman-will-be-crippled-by-someone-using-wrong-pronouns,"Instead Of Kryptonite, New LGBTQ+ Superman Will Be Crippled By Anyone Using Wrong Pronouns",BURBANK, CA—The brilliant and courageous writers at DC Comics have announced that Superman is now gay, and his pronouns are they/them as he is also non-binary. Now, instead of Kryptonite, he will be rendered completely powerless by anyone who addresses him using the wrong pronouns. "I'll finally defeat Superman! He's such a liberal snowflake!" says right-wing transphobe Lex Luthor to reporters in the latest issue."NOOOOOOOOOOOOOO!" cries gay Superman in response as he withers to the ground in shrieks of agony. "I'm non-binary! It should be 'THEY is such a snowflake!' EEEEEEEEEEEEEEE!" Writers confirmed that gay Superman will gay-save the world and gay-stop hate crimes with his gay superpowers. He will be completely impervious to Kryptonite but will be powerless against right-wing talk show hosts and trans-exclusionary radical feminist authors. First and foremost, he will be very, very gay. "We are so proud to break new ground with this stunning, brave, totally expected, and culturally fashionable change to the Superman character," said writer Tom Taylor. "We look forward to selling dozens and dozens of copies." 
'October 15th 2021',https://babylonbee.com/news/bernie-retires-as-his-vision-of-making-the-us-like-venezuela-has-finally-been-realized,"Bernie Retires As His Vision Of Making The U.S. Just Like Venezuela Has Finally Been Realized",BURLINGTON, VT—Bernie Sanders has retired as a U.S. Senator as his lifelong vision of making sure that America becomes just like Venezuela and other socialist countries has finally been achieved amid Biden's supply chain crisis."It's just refreshing to see these empty shelves—reminds me of simpler times visiting Cuba and the Soviet Union back in my heyday," he said to himself as he took a stroll through his local grocery store. He stopped by the deodorant aisle and smiled. "Not a single stick of deodorant to choose from. My work here is done.""I'm glad I can finally turn in my Senator's badge and gun, resting easy in the knowledge that the United States is in good hands. We'll be eating dogs before you know it."Sanders says he now takes a refreshing morning walk through the grocery store every morning, taking deep breaths as he admires the empty bread shelves, reminding him of the halcyon days. "We've gotta keep Biden in office so it can be like this all the time."
'October 15th 2021',https://babylonbee.com/news/katie-couric-admits-she-edited-interview-to-remove-rbg-saying-epstein-didnt-kill-himself,"Katie Couric Admits She Edited Interview To Remove Part Where RBG Said 'Epstein Didn't Kill Himself'",U.S.—Katie Couric has admitted to editing an interview with Ruth Bader Ginsburg to remove the part where the late Supreme Court Justice said, "Jeffrey Epstein did not kill himself."The shocking revelation came as Couric admitted to editing out Ginsburg's comments about the police. But this is even more amazing, as the justice pointed out that Epstein was likely murdered."I wanted to make sure Justice Ginsburg was not spreading false information like that," Couric said in defense of her deceptive editing practices. "It would have reflected badly on her and made people think she couldn't do her job. Everyone knows that Epstein killed himself and that's that. Absolutely nothing shady happened there.""Also, for the record, I do not have any dirt on Hillary Clinton and am in fine mental health."According to the full transcript of the interview, Ginsburg said, "You know, it just doesn't add up. The jail cell tape went missing, the guards had some shifty stuff going on. I bet Epstein had dirt on a lot of people that would want him dead. I'm gonna go on the record here and say that Jeffrey Epstein didn't kill himself."Ginsburg reportedly went on to say other controversial statements that Couric edited out, such as "F--- Joe Biden", "Taxation is theft", and "Make America great again."
'October 15th 2021',https://babylonbee.com/news/due-to-supply-shortages-husbands-may-need-to-begin-shopping-for-christmas-presents-prior-to-december-24-this-year,"Due To Supply Shortages, Husbands May Need To Begin Shopping For Christmas Presents Prior To December 24 This Year",U.S.—Supply shortages all across the country are spelling out potential disaster for husbands this year, as they will now need to begin shopping for their wives before December 24. Traditionally, men have been able to rely on the strong supply of consumer goods in this country. They take for granted the fact that they can just pop over to the store on the way home from work on Christmas Eve and grab a bunch of stuff, hoping it appeases their wife. But no longer, experts say."We're advising all men to start their Christmas shopping sometime before late December this year," said one economist. "You might not be able to frantically run into a big-box store an hour before closing on Christmas Eve and just throw stuff in your cart willy-nilly, because, well, there may not be anything left.""You won't be able to count on there being shelves and shelves full of candles, lotions, and gift cards you don't even know if she would like you can grab at random this year."In response to the urging of officials, the nation's husbands have begrudgingly agreed to begin shopping on December 23.
'October 15th 2021',https://babylonbee.com/news/jeff-bezos-invites-456-lucky-contestants-to-compete-in-childrens-games-for-seat-on-his-next-space-flight,"Jeff Bezos Invites 456 Lucky Contestants To Compete In Series Of Children's Games For Seat On His Next Space Flight",UNKNOWN—On a remote island in the East China Sea, 456 groggy, drugged-up Americans woke up in a room full of bunk beds. One by one, they came to, with hazy memories of a van pulling up and nabbing them off the streets."Welcome, welcome!" a cheery voice greeted them. Emerging from the shadows was none other than billionaire Jeff Bezos. "Shall we play a game?" Bezos informed the hapless pawns in his game that they would compete in a series of children's activities, such as red light, green light, hopscotch, and a creation of his own called "Smear the Elon."During the first game, terrified contestants learned the hard way that those who lose the games are immediately gunned down. "But wait!" Bezos said as they demanded he let them go. "I haven't revealed the prize yet!" He pressed a button to lower a large piggy bank from the ceiling containing one ticket for the next Blue Origin flight, but accidentally pressed the trapdoor button, sending himself plummeting into the alligator pit. "Why do I even have that button?" he muttered to himself as he kicked a gator off his foot.Amazon has confirmed that participation in the next series of games will be mandatory for all Americans.
'October 15th 2021',https://babylonbee.com/news/worship-leader-ascends-into-glory-after-learning-fifth-chord,"Worship Leader Ascends Into Glory After Learning Fifth Chord",HOUSTON, TX—Worship leader Kevin Stephens learned a fifth guitar chord last Saturday during a jam session, and the praise band reported that he was immediately taken up by the Lord into Heavenly glory.Just last year, Kevin had learned a fourth chord, launching him into the upper echelon of praise leaders. "This is rare air you're breathing," said Chris Tomlin at the time, congratulating Kevin on his incredible success. "Your future is good, good good, good good good good good. It's what it is."The praise band had been hard at work figuring out how to make the bridge for 'Oceans' last until Deacon Bob's heart failure won out when Kevin was struck with an idea. "What if, what if what if what if...I played a different chord as like, as like as like as like, a transition, and then went back to the bridge?"The rhythm guitar player scratched the shock of hair coming out from his toboggan, wondering aloud if this was heresy. The bass player said nothing, being a phantom of everyone's imagination. The drummer said something profound, but it was muffled by his cage. The female vocalist just looked at him longingly, wondering if he had noticed her yet for her beautiful, inaudible harmonizing. Kevin decided to go for it.Immediately, the roof shattered, the clouds parted, and angels came to bring Kevin into eternal glory. "This is my praise band leader, in whom I am well pleased," boomed a voice from on high. "There were just no praise songs left for Kevin down here on Earth," said Pastor Terry Stegall of Church On The Rock. "I always said that kid could stretch a song bridge into eternity. I guess he finally did."
'October 15th 2021',https://babylonbee.com/news/gay-superman-will-use-super-hearing-to-listen-for-fabulous-antiquing-deals,"Gay Superman Will Use Super-Hearing To Listen For Fabulous Antiquing Deals",BURBANK, CA—DC Comics has announced that Superman's son, named Superman Jr., is gay. In the upcoming series of comics, Superman Jr. will settle down with his partner in Greenwich Village in Metropolis, adopt some cats, and go antiquing on weekends. "The cool thing about gay Superman's weekend shopping trips is he'll be able to use his super-hearing to scout out all the best deals on antiques for his quaint little apartment," said writer Tom Taylor. "So that will be kinda cool. Then he can, like, fly there real quick and snag the bargain antique before anyone else. Did we mention he'll have some cats? I don't think there have been pet cats in a Superman comic before, so yeah, that's pretty neat. We hope this makes us relevant again so you'll buy our comics."Sources say the legendary superhero will have a new backstory, having escaped from Krypton after homophobic aliens destroyed it due to all the gayness that was there. He will then fly to earth to fight bigots."Our new villain Mike Von Pence will be the most fearsome villain we've written to date," said Taylor. "Gay Superman Jr. will thwart his evil master plan to hook everyone up to electroshock therapy and turn Metropolis into the Handmaid's Tale."According to sources, gay Superman will also team up with another new spin on a classic character: straight Aquaman.   
'October 15th 2021',https://babylonbee.com/news/spirit-halloween-sets-up-shop-on-empty-grocery-store-shelves,"Spirit Halloween Sets Up Shop On Empty Grocery Store Shelves",U.S.—Spirit Halloween has opened up thousands of new venues on the empty grocery store shelves across the country, sources confirmed Friday. The pop-up Halloween stores showed up overnight, hanging banners along bread aisles, toilet paper aisles, meat aisles, and shelves previously home to all kinds of other basic necessities.The costume and party supply store will sell its wares at tiny little stores all along the shelves. Shoppers who are unable to acquire bread and milk will be able to treat themselves to tiny little costumes and Halloween accessories. "Please be aware that none of our products are edible," said CEO David S. Pumpkins. "In fact, they probably contain lead paint and stuff since they're from China. So if you're starving we can't help you, but we hope we can at least brighten your day with a little Halloween cheer!"Sources did confirm that for especially desperate people, the rubber Freddy Krueger masks are somewhat edible if you boil them long enough. Unfortunately, the Spirit Halloween shelves remained bare since their entire stock is still sitting on a stranded cargo ship outside Long Beach. 
'October 15th 2021',https://babylonbee.com/news/al-qaeda-threatening-to-release-insensitive-comedy-special,"Al-Qaeda To Destabilize U.S. With New Insensitive Comedy Special",SECRET CAVE—Al-Qaeda is still around and plotting against the U.S., and now they know exactly how to hurt us. This time, they’re threatening to release an extremely politically incorrect comedy special.“No topic will be taboo,” said the founder of Al-Qaeda, Bob Al-Qaeda. “LGBTQ issues — trans issues specifically — racial issues — you will be screaming at the screen, ‘No! Don’t go there!’ But we swear by Allah we will go there.”The threat was met with immediate panic in the U.S. “These insensitive jokes could literally get people killed!” screamed one left-wing activist. “We have to stop this! Shut down the internet if we must! And give in to all their demands!” President Biden said he was giving in to their demands as he was “pulling out of Afghanistan as fast as he can” but he’s not sure it will be enough to stop the terrorist word-violence.It’s unknown how the comedy special will be released. It’s possible it will come out on Netflix. “We did release Cuties,” said Netflix CEO and founder, Bob Netflix. “So it would be pretty hypocritical to draw the line at Al-Qaeda.”The Department of Homeland Security is calling on everyone to be vigilant and to report the sound of laughter since proper, sensitive, progressive humor should never evoke any other sound than clapping.There are concerns, however, that the Al-Qaeda comedian will bomb.
'October 14th 2021',https://babylonbee.com/news/boy-who-pointed-out-the-emperor-has-no-clothes-banned-for-misinformation,"Boy Who Pointed Out The Emperor Has No Clothes Banned For Misinformation",U.S.—Twitter, Facebook, YouTube, TikTok, and Instagram have all confirmed they have banned a young peasant child from their social networks after he pointed out that the emperor has no clothes.The brouhaha started after God-Emperor Joseph I showed off his new wardrobe at a press conference this morning. The press reported his fashion was "impeccable" and that he looked like an "even hotter George Clooney," but some far-right extremists said that he was actually naked."Is it just me, or is the emperor not wearing any clothes?" the boy posted on his social media accounts Thursday. Censors worked quickly, flagging his tweet with a warning that it was potentially harmful misinformation. Snopes fact-checked his claim and found that it was "mostly false," as the emperor was wearing socks. CNN dug into his old tweets and found that he tweeted that his best friend Castellan was a "booger head" two years ago.He made his case for the emperor actually being completely naked on his Parler account, prompting Amazon to immediately take down all of Parler. The IRS is also looking into his accounts as he had over 600 copper pieces in his satchel, and the FBI is going after him as he had a castle Lego set at his home, causing some to wonder if he was going to attack the emperor's castle and cause an insurrection.Meanwhile, the emperor, who is very old and mostly stays in the castle dungeon eating ice cream, had his spokesperson, Lady Jen Flocky, address the controversy. "Hear ye! Hear ye! The emperor is wearing the finest clothes, I assure you all," she said. "By his majesty's royal decree, anyone who says otherwise will be thrown into the alligator pit!"
'October 14th 2021',https://babylonbee.com/news/cat-rests-up-in-preparation-for-long-night-running-up-and-down-stairs,"Cat Rests Up In Preparation For Long Night Running Up And Down Stairs",MENIFEE, CA—Local unemployed cat Autumn got another good day's rest Thursday in preparation for a long evening running up and down the stairs at random times. "Sporadically running upstairs, and then downstairs, and then upstairs again to keep my humans awake is exhausting," Autumn told reporters, yawning, as she woke up from her seventh nap of the day. "It's not an easy job, but someone has to do it. Now, if you'll excuse me, I have to go meow by my food dish so my humans can move the food around and make it look like there's more food in there than there is." The cat says she is planning on some new moves today, including a few parkour tricks like jumping off the walls and kicking over a laundry basket and then fleeing through the house like a bat out of heck. Autumn has also filed a complaint of animal abuse against her owners for only holding the door open for her for seven hours at a time while she decides if she wants to go outside or stay inside.
'October 14th 2021',https://babylonbee.com/news/backed-up-cargo-ships-positioned-to-spell-out-lets-go-brandon,"Backed-Up Cargo Ships Positioned To Spell Out ‘Let’s Go Brandon’",PACIFIC OCEAN—With a tremendous backlog at Long Beach and dozens of cargo ships helplessly stranded in the ocean waiting to be unloaded, the bored crews have arranged their ships to form the words of the patriotic cheer taking the world by storm: "Let's Go Brandon." "Yeah, let's go Brandon!" said one ship's captain as he removed the cork from a bottle of mead and took a long, slow drink. "We here on the high seas often sing our sea shanties in his honor and pour out rum for such a swell guy.""SQUAWK! SUCH A SWELL GUY!" the parrot on his shoulder repeated.The captain said he and the other ship captains wanted to spell out a different phrase, but it was rated "ARRRRR".Experts who know what they're talking about say the catastrophic background has nothing to do with labor shortages due to vaccine mandates, or any policy related to President Biden and his highly competent Transportation Secretary Pete Buttigieg."Hey wow! Look at all those really big boats!" said Buttigieg while visiting the port. "Boats go vroooom! Pretty colors! I like the blue one!" He then went back home to play some Ticket to Ride and Mario Kart to help educate himself on more transportation-related issues.Longshoremen predict they will have the backlog fixed by 2028.
'October 14th 2021',https://babylonbee.com/news/adventurers-slay-giant-spiders-and-now-the-land-is-overrun-with-giant-flies,"Concerning Growth In Number Of Giant Flies As Adventurers Keep Slaying All The Giant Spiders",FORBIDDEN FOREST—It seemed a time for celebration: Adventurers encountered several giant spiders and slew them. But soon after, the whole land became overrun with bothersome giant flies.“This is why I hate adventurers,” said the unnamed man who runs the inn in the nearby town of Wolfwater. “They just see some ‘monsters’ and say, ‘Hey, maybe if I kill that, I’ll get some good experience, and perhaps it will drop some gold.’ And they never think of the long-term consequences.”“The giant ecosystem — though giant — is very fragile,” explained Professor Fizzle, who works in the library in Wolfwater. “Why do you think dungeons are overrun with giant rats? Because long ago, people killed all the giant cats.”Stormbreaker, one of the adventurers who was carrying an improbable sword nearly his own size, was unapologetic. “Those spiders attacked us when we were wandering the forest in search of the entrance to the Cave of Shadows,” he explained. “What was I supposed to do? Scoop them up in a giant cup?”It is unknown now whether the citizens of Wolfwater will need to import spiders from a neighboring region to restore balance to the ecosystem, or if the spiders will respawn if they just wait long enough.
'October 14th 2021',https://babylonbee.com/news/nfl-removes-all-coaches-players-fans-who-have-ever-said-a-bad-word-only-tim-tebow-remains,"NFL Removes All Coaches, Players, Fans Who Have Ever Said A Bad Word, Only Tim Tebow Remains",U.S.—Remember super-Christian and football/baseball player Tim Tebow? The guy who took a knee before it was cool? Well, Tebow is now officially the only member of the NFL. The bold change for the league occurred after officials decided that everyone who had ever said a bad word would be removed from the league.The entire NFL will just be an empty field with Tebow tossing a ball to himself with no spectators, coaches, teammates, opponents, or commentators, sources at the league confirmed today."Welp, I guess it's just Tim out there now," said Roger Goodell in his resignation speech. "I hope everyone enjoys watching him play. Well, I mean, you can't actually watch him because we've fired you as a fan for saying something off-color once. But Tim is a good kid. He'll have fun out there."Tebow took to the field for his first NFL game as the only member of the league Thursday evening, quietly took a knee and said a prayer, and then just went out there and tossed the ball around to himself. "I just want to thank my Lord and Savior Jesus Christ for blessing me with this opportunity," Tebow said. "And I want to thank the rest of the league for being heathens who said bad words in the past. I owe it all to you guys."Tebow still didn't score any touchdowns.
