Date,Link,Heading,Body
'October 14th 2021',https://babylonbee.com/news/irs-agents-parachute-into-7-year-olds-birthday-party-on-suspicion-he-got-more-than-600-worth-of-presents,"IRS Agents Bust 7-Year-Old For Getting More Than $600 Worth Of Birthday Presents",ASHEVILLE, NC—An elite platoon of airborne IRS agents parachuted into the Smithson’s backyard during little Sally’s 7th birthday party to enforce new requirements to track any financial transactions greater than $600.Agents immediately secured the party area by puncturing the bounce castle and flex-cuffing BoBo the Juggling Gorilla. They then proceeded to thoroughly catalog all the excess income collected by the new seven-year-old.Chief Airborne Auditor Alvin “Deduction Strangler” Clarke reviewed the agents’ findings. “Cash payments in the birthday cards alone easily approach the $600 threshold, even though Papa Earl and Gigi clearly tried to cheap out with a $15 McDonald’s gift card.”Clarke continued, “We also had a trampoline, several Barbies, and a few Lego sets, although we didn’t find the Millenium Falcon that Agent Glenn was really hoping to find for his kids. I mean for the evidence in the case. That’s right. A lot of the time I refer to evidence as ‘Agent Glenn’s kids.’ Why wouldn’t I?”Sally Smithson spent the rest of the day filling out complicated tax forms while the surrounding agents ate her cake and ice cream. “This is an important lesson for a young American to learn,” said Agent Clarke. “Remember, Sally, always check with the government before you do anything. And don’t forget to check that box about donating $1 to the presidential campaign fund. Support democracy!”
'October 14th 2021',https://babylonbee.com/news/dc-introduces-straight-christian-robin,"For Sake Of Diversity, DC Introduces Straight Christian Robin",BURBANK, CA—DC Comics recently announced on National Coming Out Day that the next iteration of Batman's faithful sidekick and boy wonder Robin will be coming out as a straight, cis-male fundamentalist Christian."We always knew Robin was gay," said writer Tom Taylor. "In fact, it's apparent that pretty much every DC superhero ever written has always been super gay. We thought it was time for a meaningful change to the Batman universe."To introduce some diversity to the almost 100% gay characters of DC, Robin will be rewritten as a faithful Baptist deacon from Indiana, who has a loving wife and 5 kids, and who fights crime in his spare time. He will also patrol universities to own the libs and shut down atheists. "Robin the Christian Boy Wonder will roam the streets of Gotham with his gay mentor Batman, sharing the good news of Jesus with street thugs and Arkham inmates," Taylor explained. "He is passionately pro-life, and even protests outside the abortion clinic from time to time. He'll also have some great catchphrases like 'Holy... is the Lord God Almighty, the whole earth is filled with his glory, Batman!' We've never had a character like this before."DC said they will be continuing to push inclusion in their comics by introducing some weak female characters to bring some more diversity to their lineup of strong female characters. 
'October 13th 2021',https://babylonbee.com/news/breaking-evil-mirror-universe-william-shatner-returns-from-space,"Breaking: Evil Mirror Universe William Shatner Returns From Space",On Wednesday, William Shatner, the beloved Boston Legal actor famous for portraying attorney Denny Crane, traveled to space.Shatner was one of four people aboard Jeff Bezos’s cucumber-shaped Blue Origin rocket as it soared to the edge of the atmosphere, offering breathtaking views and a few minutes of weightlessness. The shaft of the eggplant-shaped craft then detached and passengers floated back to earth. The mission seemed to be a success, but concerned witnesses said something about Shatner seemed off."He seemed…evil," said another crew member. "And he had a black goatee that really added to his evil look."After attempting to sabotage the next flight by removing the inertial dampeners and randomly attacking a civilian in a red shirt, Shatner declared that West Texas, where he landed, was “now part of the Terran Empire.” When Bezos attempted to congratulate him on his journey, Shatner cracked a bunch of bald jokes and mocked Bezos for being only the second richest person in the world.Experts theorize that somewhere in the lower atmosphere, the mushroom-shaped vessel encountered a disruption in the space/time continuum, and the William Shatner from our reality was replaced by a sinister William Shatner from a parallel timeline. Worst of all, the mirror Shatner is almost indistinguishable from our William Shatner, save his striking goatee and big, thick, evil eyebrows.Thankfully, the threat posed by evil William Shatner is predicted to be short-lived since, like the real William Shatner, he is 90 years old. Due to his age, he will probably return to the heavens soon, and this time not in a bratwurst-shaped spacecraft.
'October 13th 2021',https://babylonbee.com/news/8-great-uses-for-your-bible-since-you-never-take-the-time-to-read-it-you-heathen,"8 Other Uses For Your Bible Since We Know You're Not Reading It, You Sinner",Brought to you by:So you have this Bible in your house, but who's gonna read it? Not you, because you are a lazy, insolent heathen. We get it- you don't have enough time. Those 3-hour Joe Rogan podcasts won't listen to themselves. To keep your Bible from going to waste, here are 8 other great uses for it:#1) Coffeeshop Instagram photoshoot accessory: Take some artistic photos of your huge leather-bound Bible next to your morning coffee, add a sepia filter, and BOOM. Instant spirituality!#2) Carry it with you on airplanes so people won't try to talk to you: Works like a charm.#3) Leave it around the house in strategic places so your inconsiderate spouse can read it and maybe learn a few things: You may not need to read the Bible, but your spouse sure as heck does.#4) Use the maps in the back to plan your invasion of Canaan: It's worth considering. Apparently, they have milk and honey. #5) Gravity tester: Ever suddenly get worried gravity stopped working? Just hold up your Bible, let go, and make sure it falls to the ground. If it doesn’t... uh oh. Something’s wrong! #6) Discipline your cat: If your cat is acting up and scratching things, then make him read the Bible. Cats hate reading.#7) Hold it up for a photo-op after clearing out protesters with tear gas: This is an EPIC power move.#8) Fight off vampires: Are vampires trying to get into your house? Drop the Bible on their heads... but only if gravity is working.WAIT! This part isn't satire! In all seriousness, do you need to read your Bible more? Of course you do, you sinner. Try listening or reading along to God's Word using Dwell, the most creative Bible experience available in the App and Google Play Store. And get this! Dwell is giving all Babylon Bee readers free access to their app for 7 days, plus a coupon for 30% off. Get this exclusive deal now! 
'October 16th 2021',https://babylonbee.com/news/dont-understand-the-babylon-bees-jokes-here-are-10-of-them-explained,"Here Are 10 Babylon Bee Jokes Explained (Just In Case You Don't Get Them)",From the Atlantic to the Pacific, a lot of people all across the country don't understand Babylon Bee jokes. That's because we conservative Christians are bad at humor. We're nowhere near as funny as leftist humorists like Samantha Bee and Jimmy Kimmel. So, to make sure you understand the headlines at The Babylon Bee, we've included ten classic Bee articles here along with a helpful explanation.OK, here we go:EXPLANATION: The joke here is that AOC (who is dumb), accidentally strangled herself tying her shoes, which is a simple task for most humans, because she is so stupid. Hope this is helpful.EXPLANATION: The joke here is that Democrats called for flags to be flown at half-mast to grieve the death of General Soleimani. Get it? A terrorist died and Democrats were sad.EXPLANATION: This one is a joke that NBA players were wearing special lace collars to honor Ruth Bader Ginsburg, who had recently passed away. The humor derives from the fact that they are NBA players wearing lace collars, which is humorous.EXPLANATION: Actually, this one's about sports, and we aren't really into sports. So we don't understand this one. If you get it, please explain it to us in the comments.EXPLANATION: The joke here is that celebrities got in their yachts, sailed out west of Malibu, and spelled out "WE'RE ALL IN THIS TOGETHER" with said yachts. Because they are rich (and also stupid).EXPLANATION: Wait a minute, this is real news! This isn't one of ours! How'd this get in here? Wish we had thought of this one, though.EXPLANATION: The joke here is that Bernie tested negative for president, because he is not the president. And also is a dumb socialist.EXPLANATION: Ah, nostalgia! A joke back from when The Babylon Bee told Christian jokes. The joke here is that Joel Osteen sailed his yacht through flooded Houston to hand out copies of his book Your Best Life Now, rather than offering help to those in need. Classic!EXPLANATION: The joke here is that a motorcyclist identified as a bicyclist and subsequently set a cycling world record. Because motorcycles are faster than bicycles.EXPLANATION: The joke here is that a grown man identified as a six-year-old... hey, wait a minute! That's the same joke! Get new material, Bee!We hope you found this helpful. If you liked these jokes, preorder our new book, The Babylon Bee Guide to Wokeness. It is jam-packed with over two jokes!
'October 16th 2021',https://babylonbee.com/news/pete-buttigieg-says-he-cannot-come-into-work-as-he-is-on-breastfeeding-duty,"Pete Buttigieg Says He Cannot Come Into Work As He Is On Breastfeeding Duty",WASHINGTON, D.C.—With catastrophic labor shortages and port congestion bringing America's supply chain to its knees, many are wondering if Transportation Secretary and new mother Pete Buttigieg will ever go back to work and address the problem."I would totally come back to work," said Buttigieg as he held his new baby, "but I need to take my paternity leave followed by several more months of maternity leave. Plus, as the twins' mother, I drew the short straw and got breastfeeding duty! These babies are keeping me up all hours of the night to breastfeed!"Buttigieg also cited his need for extended bed rest following a difficult labor. "It really did a number on me," he said. "I'm still so tired and hormonal, and those varicose veins and stretch marks! So many stretch marks!"Sources later confirmed the varicose veins and stretch marks were unrelated to the new babies. The Buttigieg's confirmed they are supplementing with infant formula since breastfeeding has proven difficult. "We thought there might have been a problem when the babies started losing a ton of weight. Thankfully, our house servant María told us about baby formula which really helps!"Buttigieg has suggested in the meantime that port authorities employ the help of Theodore Tugboat and get some bigger choo-choo trains to help clear the supply chain backlog. 
'October 16th 2021',https://babylonbee.com/news/instead-of-kryptonite-new-lgbtq-superman-will-be-crippled-by-someone-using-wrong-pronouns,"Instead Of Kryptonite, New LGBTQ+ Superman Will Be Crippled By Anyone Using Wrong Pronouns",BURBANK, CA—The brilliant and courageous writers at DC Comics have announced that Superman is now gay, and his pronouns are they/them as he is also non-binary. Now, instead of Kryptonite, he will be rendered completely powerless by anyone who addresses him using the wrong pronouns. "I'll finally defeat Superman! He's such a liberal snowflake!" says right-wing transphobe Lex Luthor to reporters in the latest issue."NOOOOOOOOOOOOOO!" cries gay Superman in response as he withers to the ground in shrieks of agony. "I'm non-binary! It should be 'THEY is such a snowflake!' EEEEEEEEEEEEEEE!" Writers confirmed that gay Superman will gay-save the world and gay-stop hate crimes with his gay superpowers. He will be completely impervious to Kryptonite but will be powerless against right-wing talk show hosts and trans-exclusionary radical feminist authors. First and foremost, he will be very, very gay. "We are so proud to break new ground with this stunning, brave, totally expected, and culturally fashionable change to the Superman character," said writer Tom Taylor. "We look forward to selling dozens and dozens of copies." 
'October 15th 2021',https://babylonbee.com/news/bernie-retires-as-his-vision-of-making-the-us-like-venezuela-has-finally-been-realized,"Bernie Retires As His Vision Of Making The U.S. Just Like Venezuela Has Finally Been Realized",BURLINGTON, VT—Bernie Sanders has retired as a U.S. Senator as his lifelong vision of making sure that America becomes just like Venezuela and other socialist countries has finally been achieved amid Biden's supply chain crisis."It's just refreshing to see these empty shelves—reminds me of simpler times visiting Cuba and the Soviet Union back in my heyday," he said to himself as he took a stroll through his local grocery store. He stopped by the deodorant aisle and smiled. "Not a single stick of deodorant to choose from. My work here is done.""I'm glad I can finally turn in my Senator's badge and gun, resting easy in the knowledge that the United States is in good hands. We'll be eating dogs before you know it."Sanders says he now takes a refreshing morning walk through the grocery store every morning, taking deep breaths as he admires the empty bread shelves, reminding him of the halcyon days. "We've gotta keep Biden in office so it can be like this all the time."
'October 15th 2021',https://babylonbee.com/news/katie-couric-admits-she-edited-interview-to-remove-rbg-saying-epstein-didnt-kill-himself,"Katie Couric Admits She Edited Interview To Remove Part Where RBG Said 'Epstein Didn't Kill Himself'",U.S.—Katie Couric has admitted to editing an interview with Ruth Bader Ginsburg to remove the part where the late Supreme Court Justice said, "Jeffrey Epstein did not kill himself."The shocking revelation came as Couric admitted to editing out Ginsburg's comments about the police. But this is even more amazing, as the justice pointed out that Epstein was likely murdered."I wanted to make sure Justice Ginsburg was not spreading false information like that," Couric said in defense of her deceptive editing practices. "It would have reflected badly on her and made people think she couldn't do her job. Everyone knows that Epstein killed himself and that's that. Absolutely nothing shady happened there.""Also, for the record, I do not have any dirt on Hillary Clinton and am in fine mental health."According to the full transcript of the interview, Ginsburg said, "You know, it just doesn't add up. The jail cell tape went missing, the guards had some shifty stuff going on. I bet Epstein had dirt on a lot of people that would want him dead. I'm gonna go on the record here and say that Jeffrey Epstein didn't kill himself."Ginsburg reportedly went on to say other controversial statements that Couric edited out, such as "F--- Joe Biden", "Taxation is theft", and "Make America great again."
'October 15th 2021',https://babylonbee.com/news/due-to-supply-shortages-husbands-may-need-to-begin-shopping-for-christmas-presents-prior-to-december-24-this-year,"Due To Supply Shortages, Husbands May Need To Begin Shopping For Christmas Presents Prior To December 24 This Year",U.S.—Supply shortages all across the country are spelling out potential disaster for husbands this year, as they will now need to begin shopping for their wives before December 24. Traditionally, men have been able to rely on the strong supply of consumer goods in this country. They take for granted the fact that they can just pop over to the store on the way home from work on Christmas Eve and grab a bunch of stuff, hoping it appeases their wife. But no longer, experts say."We're advising all men to start their Christmas shopping sometime before late December this year," said one economist. "You might not be able to frantically run into a big-box store an hour before closing on Christmas Eve and just throw stuff in your cart willy-nilly, because, well, there may not be anything left.""You won't be able to count on there being shelves and shelves full of candles, lotions, and gift cards you don't even know if she would like you can grab at random this year."In response to the urging of officials, the nation's husbands have begrudgingly agreed to begin shopping on December 23.
'October 15th 2021',https://babylonbee.com/news/jeff-bezos-invites-456-lucky-contestants-to-compete-in-childrens-games-for-seat-on-his-next-space-flight,"Jeff Bezos Invites 456 Lucky Contestants To Compete In Series Of Children's Games For Seat On His Next Space Flight",UNKNOWN—On a remote island in the East China Sea, 456 groggy, drugged-up Americans woke up in a room full of bunk beds. One by one, they came to, with hazy memories of a van pulling up and nabbing them off the streets."Welcome, welcome!" a cheery voice greeted them. Emerging from the shadows was none other than billionaire Jeff Bezos. "Shall we play a game?" Bezos informed the hapless pawns in his game that they would compete in a series of children's activities, such as red light, green light, hopscotch, and a creation of his own called "Smear the Elon."During the first game, terrified contestants learned the hard way that those who lose the games are immediately gunned down. "But wait!" Bezos said as they demanded he let them go. "I haven't revealed the prize yet!" He pressed a button to lower a large piggy bank from the ceiling containing one ticket for the next Blue Origin flight, but accidentally pressed the trapdoor button, sending himself plummeting into the alligator pit. "Why do I even have that button?" he muttered to himself as he kicked a gator off his foot.Amazon has confirmed that participation in the next series of games will be mandatory for all Americans.
'October 15th 2021',https://babylonbee.com/news/worship-leader-ascends-into-glory-after-learning-fifth-chord,"Worship Leader Ascends Into Glory After Learning Fifth Chord",HOUSTON, TX—Worship leader Kevin Stephens learned a fifth guitar chord last Saturday during a jam session, and the praise band reported that he was immediately taken up by the Lord into Heavenly glory.Just last year, Kevin had learned a fourth chord, launching him into the upper echelon of praise leaders. "This is rare air you're breathing," said Chris Tomlin at the time, congratulating Kevin on his incredible success. "Your future is good, good good, good good good good good. It's what it is."The praise band had been hard at work figuring out how to make the bridge for 'Oceans' last until Deacon Bob's heart failure won out when Kevin was struck with an idea. "What if, what if what if what if...I played a different chord as like, as like as like as like, a transition, and then went back to the bridge?"The rhythm guitar player scratched the shock of hair coming out from his toboggan, wondering aloud if this was heresy. The bass player said nothing, being a phantom of everyone's imagination. The drummer said something profound, but it was muffled by his cage. The female vocalist just looked at him longingly, wondering if he had noticed her yet for her beautiful, inaudible harmonizing. Kevin decided to go for it.Immediately, the roof shattered, the clouds parted, and angels came to bring Kevin into eternal glory. "This is my praise band leader, in whom I am well pleased," boomed a voice from on high. "There were just no praise songs left for Kevin down here on Earth," said Pastor Terry Stegall of Church On The Rock. "I always said that kid could stretch a song bridge into eternity. I guess he finally did."
'October 15th 2021',https://babylonbee.com/news/gay-superman-will-use-super-hearing-to-listen-for-fabulous-antiquing-deals,"Gay Superman Will Use Super-Hearing To Listen For Fabulous Antiquing Deals",BURBANK, CA—DC Comics has announced that Superman's son, named Superman Jr., is gay. In the upcoming series of comics, Superman Jr. will settle down with his partner in Greenwich Village in Metropolis, adopt some cats, and go antiquing on weekends. "The cool thing about gay Superman's weekend shopping trips is he'll be able to use his super-hearing to scout out all the best deals on antiques for his quaint little apartment," said writer Tom Taylor. "So that will be kinda cool. Then he can, like, fly there real quick and snag the bargain antique before anyone else. Did we mention he'll have some cats? I don't think there have been pet cats in a Superman comic before, so yeah, that's pretty neat. We hope this makes us relevant again so you'll buy our comics."Sources say the legendary superhero will have a new backstory, having escaped from Krypton after homophobic aliens destroyed it due to all the gayness that was there. He will then fly to earth to fight bigots."Our new villain Mike Von Pence will be the most fearsome villain we've written to date," said Taylor. "Gay Superman Jr. will thwart his evil master plan to hook everyone up to electroshock therapy and turn Metropolis into the Handmaid's Tale."According to sources, gay Superman will also team up with another new spin on a classic character: straight Aquaman.   
'October 15th 2021',https://babylonbee.com/news/spirit-halloween-sets-up-shop-on-empty-grocery-store-shelves,"Spirit Halloween Sets Up Shop On Empty Grocery Store Shelves",U.S.—Spirit Halloween has opened up thousands of new venues on the empty grocery store shelves across the country, sources confirmed Friday. The pop-up Halloween stores showed up overnight, hanging banners along bread aisles, toilet paper aisles, meat aisles, and shelves previously home to all kinds of other basic necessities.The costume and party supply store will sell its wares at tiny little stores all along the shelves. Shoppers who are unable to acquire bread and milk will be able to treat themselves to tiny little costumes and Halloween accessories. "Please be aware that none of our products are edible," said CEO David S. Pumpkins. "In fact, they probably contain lead paint and stuff since they're from China. So if you're starving we can't help you, but we hope we can at least brighten your day with a little Halloween cheer!"Sources did confirm that for especially desperate people, the rubber Freddy Krueger masks are somewhat edible if you boil them long enough. Unfortunately, the Spirit Halloween shelves remained bare since their entire stock is still sitting on a stranded cargo ship outside Long Beach. 
'October 15th 2021',https://babylonbee.com/news/al-qaeda-threatening-to-release-insensitive-comedy-special,"Al-Qaeda To Destabilize U.S. With New Insensitive Comedy Special",SECRET CAVE—Al-Qaeda is still around and plotting against the U.S., and now they know exactly how to hurt us. This time, they’re threatening to release an extremely politically incorrect comedy special.“No topic will be taboo,” said the founder of Al-Qaeda, Bob Al-Qaeda. “LGBTQ issues — trans issues specifically — racial issues — you will be screaming at the screen, ‘No! Don’t go there!’ But we swear by Allah we will go there.”The threat was met with immediate panic in the U.S. “These insensitive jokes could literally get people killed!” screamed one left-wing activist. “We have to stop this! Shut down the internet if we must! And give in to all their demands!” President Biden said he was giving in to their demands as he was “pulling out of Afghanistan as fast as he can” but he’s not sure it will be enough to stop the terrorist word-violence.It’s unknown how the comedy special will be released. It’s possible it will come out on Netflix. “We did release Cuties,” said Netflix CEO and founder, Bob Netflix. “So it would be pretty hypocritical to draw the line at Al-Qaeda.”The Department of Homeland Security is calling on everyone to be vigilant and to report the sound of laughter since proper, sensitive, progressive humor should never evoke any other sound than clapping.There are concerns, however, that the Al-Qaeda comedian will bomb.
