Date,Link,Heading,Body
'October 8th 2021',https://babylonbee.com/news/democrats-clarify-that-men-are-allowed-to-have-opinion-on-abortion-as-long-as-theyre-for-it,"Democrats Clarify That Men Are Allowed To Have Opinion On Abortion As Long As They're For It",WASHINGTON, D.C.—In a press conference to protest the Texas abortion ban, Democrat leaders called on men across the country to stand up for the right of women to kill their sons and daughters through all 9 months of pregnancy. "We've always said 'no uterus, no opinion', but we need to clarify that," said Speaker Nancy Pelosi. "If you have no uterus but you are pro-abortion, you're totally allowed to have an opinion. In fact, if you are a man, and you're not loudly and forcefully—in a very masculine way—voicing your pro-choice opinion to everyone in support of abortion, you probably hate women."The nation's Democrat men were a little confused, after having been told to shut up for the last 50 years, but were really thankful Democrat women were now allowing them to talk."So if we say we're cool with killing babies will you let us talk sometimes?" said all the Democrat men."Yeah, that's ok now! We need your voice!" said Democrat women. The men suddenly felt conflicted, having never been allowed to have an opinion before. Sources say when they actually thought about it, they weren't sure if they were cool with killing their own children. When they expressed their opinion that they were no longer sure about abortion, Democrat women told them to shut up and sit in the corner again. "We will only welcome the opinions of men who completely agree with our radical views on baby-killing," said Pelosi. 
'October 8th 2021',https://babylonbee.com/news/joe-biden-invites-brandon-to-the-white-house-to-congratulate-him-for-his-success,"Joe Biden Invites Brandon To The White House To Congratulate Him For His Success",WASHINGTON, D.C.—President Biden has invited national hero "Brandon" to the White House to congratulate him on his smashing success at football games, NASCAR races, and even gatherings of New York City educators."Wow, this Brandon must be quite a fella!" said President Biden after listening to another raucous chant. "For him to get crowds from all across this divided country to all be united together with such passion?  I just can't believe that many people could all feel so strongly about one single man! We need a lot more Brandons in our country, I'll tell you that right now! Let's go, Brandon!"President Biden reportedly was so impressed with the national unity he was witnessing, he asked aides to record every single instance of crowds cheering "Let's go Brandon!" so he could listen to them all in a row. The President has apparently taken to showing the clips to lawmakers to start off meetings, in hopes of helping each side find a slice of common ground they can really agree on."How 'bout that? That's the kind of unity we need in these halls right here!" said Biden as he showed the highlight reel to a group of Senators. "Now I know we got our differences, but for just a few minutes, let's all step back and realize we are on the same team. And that team is team America, and team America is cheering for Brandon. Are you with these great crowds of people or not?"Senator Ted Cruz stepped straight forward, solemnly promising the President he would never, ever stop cheering for Brandon. Senator Klobuchar wept in the corner, wondering how she got smoked in a primary by this guy.President Biden has decided to invite Brandon to the White House for a special ceremony to honor the incredible work he has been doing all over the country. When told that they couldn't really bring this 'Brandon' to the White House in person, Biden ordered the FBI to cease all work on child trafficking and immediately get to work locating Brandon.
'October 8th 2021',https://babylonbee.com/news/biden-has-record-low-approval-on-economy-foreign-policy-basic-speech-standing-upright-continence-math-the-alphabet-remembering-all-the-animal-sounds-respecting-personal-space-ran-out-of-room-see-article-for-more,"Biden Hits Record Low Approval Rating On Economy, Foreign Policy, Pronouncing Words, Standing Upright, Continence, Inflation, Math, The Alphabet, Remembering All The Animal Sounds, Respecting Personal Space (Ran Out Of Room, See Article For More)",(Continued from headline) handling of the pandemic, the border crisis, not getting Firefly renewed, gas prices, inflation, education, relations with China, Mario Kart skills, Super Smash Bros. skills, ability to not accidentally drone strike civilians, negotiation skills in Catan, numchuck skills, bo staff skills, the weather, number of Todds in the country, not being a psychopathic dictator, confidence in our nation's future, handling of the squirrel population, not yet pushing California into the sea, number of men wearing hats, price of cheese, price of bread, price of homes, spending, how often he watches Matlock instead of doing his job, how many Americans own flying cars and/or hoverboards, allowing the McRib to return, allowing the pregnant man emoji, masks on airplanes, frequency of hair sniffing, civil unrest, the unity of the nation, confidence that we won't be living in a Mad Max-style post-apocalyptic wasteland in the next five years, ability to pick a good vice president, ability to pick a good ice cream flavor, ability to say numbers, hairstyle, sense of fashion, number of Steves in the country, TikTok dances, handling of the ferret crisis, knowledge of what Twitter is, knowledge of what the Constitution is, knowledge of who the president is, Portland still existing, and badgers.
'October 8th 2021',https://babylonbee.com/news/dave-chappelle-reads-from-biology-textbook-in-scandalous-new-netflix-special,"In Controversial New Netflix Special, Dave Chappelle Just Reads From A Biology Textbook",U.S.—In a controversial new Netflix special, comedian Dave Chappelle does the unthinkable, pushing the boundaries of comedy further than they've ever been pushed before. Chappelle calmly gets up at the beginning of the show to cheers from the crowd, quietly opens a fourth-grade biology textbook, and begins reading."The X and Y chromosomes, also known as the sex chromosomes, determine the biological sex of an individual," he read."Boo!" shouted someone in the crowd. "This is way too far!" The fearless comedian pressed on. "Females inherit an X chromosome from the father and receive an XX genotype. Males inherit a Y chromosome and thus have an XY genotype."Screams erupted from the auditorium. A cat shrieked. People ran, trampling over each other. "I didn't mean to offend you!" Chappelle called out. "Please remain seated, ladies and gentlemen!" Everyone instantly dropped dead.
'October 8th 2021',https://babylonbee.com/news/texas-introduces-express-lanes-for-guys-in-cowboy-hats-driving-lifted-pickup-trucks-alone,"Texas Introduces Express Lanes For Guys In Cowboy Hats Driving Lifted Pickup Trucks Alone",AUSTIN, TX—The Texas Department of Transportation confirmed today that in order to help with traffic congestion in major cities and other high-traffic areas, the entire state will have express lanes installed for guys in cowboy hats driving lifted pickup trucks alone.While other states have rewarded drivers of electric cars and carpoolers, Texas says they're doing something a little different. Tough guys driving lifted F-150s and Silverados, as long as they wear a cowboy hat, will be incentivized with faster commutes along the exclusive lanes."Listen up here, y'all," said TXDOT spokesperson Golly Chiggins. He paused to spit into his spitoon and holster his revolvers. "This here state ain't like dem yuppies up in Cali-for-ni-yay where you get some kinda reward for savin' the planet and what-not. Here in Texas, we do things just a little bit different, ya hear?"The gathered press cheered, hooted, and hollered, and began firing their six-shooters up in the air."Now, calm down, y'all, I ain't finished," Chiggins said. "We'll have sheriffs out patrollin' to make sure no hippies get on the express lanes in their 'prius mobiles' or what have you. We gotta keep Texas Texas, y'all understand?"More cheering, hootin', and hollering. More firing of six-shooters into the air. Then someone bashed a tequila bottle over the piano player's head and a mighty-fine brawl broke out. All in all, it was a successful press conference.At publishing time, sources had confirmed you could also have up to one country girl in your pickup truck as long as you're listening to bro-country and singing about driving your lifted pickup truck on a dusty backroad with your girl up in it.
'October 8th 2021',https://babylonbee.com/news/ships-arrive-from-the-orient-laden-with-pumpkin-spice,"Ships Arrive From The Orient Laden With Pumpkin Spice",NEW YORK, NY—It’s October, and that means women in UGG boots are crowded around the ports to catch sight of the masts of ships returning from their journey to the Orient. For each of those massive wooden ships has a cargo hold filled with pumpkin spice, the fabled spice of autumn.Pumpkins are only grown on a few mountaintops in Asia. The pumpkins aren’t ready to be dried and ground up into valuable pumpkin spice until the end of September. The rare spice is worth more than its weight in gold, though it’s so potent that it’s said that an ounce of it could kill a man (but not a basic white girl). Because of its value, many ships brave the dangerous waters to fill up with the spice and return it to the states every year.“Aye, ‘twas treacherous waters,” said Captain Bellzwigger as he disembarked his vessel, with men unloading crates of spice behind him. “We lost two ships this year. So many lives lost — and I don’t even see the appeal of this stuff. But, then again, I don’t drink lattes.”
'October 7th 2021',https://babylonbee.com/news/17-things-with-a-higher-approval-rating-than-joe-biden,"17 Things With A Higher Approval Rating Than Joe Biden",Joe Biden's approval rating is not good. Sad! Not good!Here are seventeen things with higher approval ratings than Joe Biden:1. Candy corn - Even these tasteless cones of wax fare better in the polls than Sleepy Joe.2. Prostate exams - Uncomfortable but at least they don't last four years.3. The restrooms at Walmart - Unsanitary but they've never tried to sniff our hair.4. The decision to cancel Firefly - Next time Joe Biden wants to stab us in the back, he should have the guts to do it to our face.5. DMV employees - Hey, at least they know where they are.6. Pearl Harbor, the Ben Affleck movie - We don't know how this one beat Joe but it did.7. The actual attack on Pearl Harbor - At least it eventually led to the fall of Hitler.8. Andrew Cuomo's steamy new romance novel - Yeesh. Biden's numbers must be awful.9. The guy in your neighborhood who hands out toothbrushes on Halloween - Everyone has that guy. But hey, he's not trying to ruin your life.10. Long John Silver's - Something's fishy about this place but at least you can just avoid it.11. Todd - Good one, Todd! 12. Gas station sushi - Will only make you sick one time and you'll have a great story to tell.13. Gwyneth Paltrow's vagina candle - We don't know why she sells these but some people like them, we guess.14. Alex Rodriguez's vagina candle - We don't know why he sells these but some people like them, we guess.15. Installing a car seat - On a 120-degree day in Phoenix.16. Wuhan's world-famous bat soup - The taste isn't so bad, it's the consistency.17. The one true President Donald Trump - USA! USA! USA!What do you like better than Joe Biden? Let us know in the comment section, which will likely be the longest comment section ever.
'October 7th 2021',https://babylonbee.com/news/democrats-declare-democracy-has-failed-because-they-did-not-get-their-way,"Democrats Declare Democracy Has Failed Because They Did Not Get Their Way",WASHINGTON, D.C.—Democrats in Washington have declared that our democratic republic has failed because they did not get their way one single time, despite dozens and dozens of legislative and electoral victories over the past year."We did not get 100% of what we wanted; therefore, democracy has failed," said Speaker of the House Nancy Pelosi during a press conference Wednesday. "Democracy only works when the voice of the people is heard—that is, the voice of the people who agree with Democrats. When our massive, radical, previously unthinkable spending packages do not pass with the full-throated support of every legislator and American citizen in the country, we know that democracy is not working the way it is supposed to.""Get in line, people. Come on. It's what the Founding Non-Birthing People would have wanted."At publishing time, Democrats had begun calling for a dictatorship so they could always ensure that they will get their way and thus preserve democracy.
'October 7th 2021',https://babylonbee.com/news/terrorists-released-from-guantanamo-bay-to-make-room-for-parents-who-protested-school-board-meetings,"Terrorists Released From Guantanamo Bay To Make Room For Parents Who Protested At School Board Meetings",WASHINGTON, D.C.—Terrorists are being released from Guantanamo Bay in order to make room for parents protesting their children's education, sources at the State Department confirmed today. Dangerous terrorists from the Middle East, Europe, and Fresno are being released in droves as their cells are needed for this far greater threat. "See you later, Bob!" said one guard as he sent Bob the Bombin' Terrorist Guy out of the prison facility on a helicopter. "Good times playing cribbage and all that—I'll get you next time! Have a good one!" The guard then waited for the next load of detainees to arrive, and took custody of Cindy Alpers from Orange, California. "Right this way, Cindy. You'll be in a high-security cell. It's the same one Murderin' Steve stayed in for a couple of decades. Ah, Murderin' Steve. I miss that guy."
'October 7th 2021',https://babylonbee.com/news/new-app-lootdash-lets-you-send-someone-to-loot-san-francsico-stores-for-you,"New App 'LootDash' Lets You Send Someone To Loot San Francisco Stores For You",SAN FRANCISCO, CA—A hot new Silicon Valley startup allows you to send someone to loot stores in San Francisco and other Democrat-controlled cities with no laws against looting. You can loot from the comfort of your home with just a few simple steps on the app."Want to loot a bunch of stuff from Walgreens, but don't want to turn off your Netflix show? Try LootDash!" said LootDash CEO Dirk Hendersen. "Our professional LootDashers are ready and waiting to go steal some stuff from whatever stores you want. Just remember to be generous with your tips!"LootDash offers a full selection of stores, from pharmacies and big-box retailers to local mom-and-pop businesses. You can even sort the results by race so you know you're looting a white-owned store and not harming a black-owned business with your LootDash order."Want us to bust into Best Buy and get a few Xbox Ones? No problem! Just put in your LootDash order and you'll have your pallet full of Xbox systems in 30 minutes or less, guaranteed!"LootDash charges a small delivery fee for each looting run, but you can sign up for LootPass to waive delivery fees on hauls of a certain dollar value or higher.
'October 7th 2021',https://babylonbee.com/news/scientists-reveal-the-true-immunity-was-inside-you-all-along,"Scientists Reveal The True Immunity Was Inside You All Along",WORLD—People around the world are inspired as scientists recently revealed that the immunity we've all been searching so hard for was inside of us all along."If you've already recovered from COVID, you have a natural immunity that is more effective and longer-lasting than Pfizer's vaccine," said one Israeli scientist. "As it turns out, the very thing we desired with all our hearts was right in front of us the whole time, and we didn't even know it. Actually, inside of us. It's called the immune system. We totally forgot that was a thing." Experts now believe no one took the time to notice the inner strength contained in their immune systems, because it was dorky and shy and wearing glasses and had its hair in a bun. Then one day, it took off its glasses and let down its hair and everyone realized natural immunity was actually super hot."For so long, I've looked for strength and confidence in the arms of Pfizer and Moderna," said local COVID survivor Matt Frunkle, "but now I realize I have everything I need, right here inside me," he said, pointing in the general direction of his primary lymphoid organs. "I've never felt so powerful." A spokesperson from Pfizer responded by saying "You'll regret saying no to us! If we can't have you, no one will!" 
'October 7th 2021',https://babylonbee.com/news/trump-files-lawsuit-after-facebook-quiz-says-he-is-a-hufflepuff,"Trump Files Lawsuit Against Facebook After Quiz Says He's In House Hufflepuff",PALM BEACH, FL—During a rally today, former and future president Donald Trump announced he is filing a lawsuit against Facebook for a recent quiz he took on the social media platform that sorted him into House Hufflepuff.Trump said he took the quiz last week and was "shocked" by the "blatant, totally wrong misinformation" on the platform."I'd totally be a Gryffindor! Fake news!" he shouted as the crowd booed wildly. "I'm the most Gryffindor Gryffindor of all time! Everyone says so! Just look at this description: 'courage, chivalry, determination.' What's more determined than still claiming I won the election ten months later? Nothing! You wouldn't see a Hufflepuff do that! A Hufflepuff would just roll over and let Sleepy Joe win! Not good!"According to sources, Trump had answered various questions such as "A first-year drops his books in the hall, what do you do?" and "What is your favorite class at Hogwarts?", greatly enjoying imagining what he would do in various situations at Hogwarts. But as soon as the result came on the screen and said "You would be in Hufflepuff!", he immediately called his lawyers.At publishing time, Trump had begun leading the crowd in a chant of "F--- Mark Zuckerberg!"
'October 7th 2021',https://babylonbee.com/news/experts-predict-lgbt-acronym-could-stretch-around-the-earth-3-times-by-2050,"Experts Predict LGBTQ Acronym Could Circle The Earth 3 Times By 2022",U.S.—Researchers working at Portland University's prestigious School for Inclusion and Justice for 2SLGBTQQIA++ Persons estimate that the acronym for the LGBTQ+ community could wrap around the earth three times by the year 2022."At the current rate of expansion, we could see the 2SLGBTQQIAA++ community's acronym wrap around the equator by sometime later this year," said the school's head researcher, Dr. Marvin Frankfurter. "As more and more people join the ranks of the marginalized, invent new identities and genders and pronouns, we are rapidly approaching a situation where the acronym can circle the earth three times by the end of next year.""And we think this is a good thing. The more oppressed people there are, the better."Dr. Frankfurter warned, however, that Earth may not have enough space to contain the entire acronym, and we will soon have to seek out a new solar system, terraform the planets there, and create a 2SLGBTQQIAA++ alliance to unite all oppressed peoples in the 'verse, "by force if necessary."At publishing time, horrified leftists had suddenly realized the acronym would cover every single person on earth, making the 2SLGBTQQIAA++ community not special at all.
'October 7th 2021',https://babylonbee.com/news/brilliant-biden-solves-debt-crisis-by-writing-one-trillion-on-dollar-bill-with-permanent-marker,"Brilliant: Biden Solves Debt Crisis By Writing 'One Trillion' On Dollar Bill With Permanent Marker",WASHINGTON, D.C.—After weeks of partisan fighting over spending and the debt ceiling, President Biden has solved everything by simply writing "ONE TRILLION" on a one-dollar bill.The brilliant solution was proposed by AOC, who is the world's smartest socialist. "The problem is we don't have any money that says 'trillion' on it," she said. "If President Biden writes 'trillion' on a dollar bill, that makes it official because only the president can do official things like that with his official pens. Then we'll have enough money to pay for all the human rights and stuff because socialism works!" In a ceremony at the Federal Reserve yesterday, Biden took his official permanent marker and changed the value of the one-dollar bill. "Now take this to the bank and pay some debts!" he said to an aide. "And here's a little tip for your trouble." He then wrote "ONE MILLION" on a used handkerchief in his pocket and gave it to the aide. Biden is expected to solve all poverty and human suffering around the world next week by writing "INFINITY" on another dollar bill.
'October 6th 2021',https://babylonbee.com/news/top-ten-revelations-from-the-facebook-whistleblower,"Top Ten Revelations From The Facebook Whistleblower",You may have thought Facebook is nothing but a fun way to share pictures with your boomer aunt, but a whistleblower has revealed a dark side to Facebook. Here’s what she revealed:Almost no one on Facebook actually has hundreds of friends.Half the farms in Farmville are secretly growing weed.Bill Gates really did offer to give away one billion dollars if enough people like and share this post.If you’ve ever been poked on Facebook, they have your DNA.Boomers share an average of 300 million minion memes a day.The next-gen Mark Zuckerberg will be indistinguishable from a human being and completely unstoppable.The number of “happy birthday” wishes you get on Facebook has no correlation with whether your birthday will be happy.The news algorithms are specially calibrated to suppress any mention of Zuckerberg’s weird eyes.Anyone who has ever used Oculus has had his mind reprogrammed to assassinate Jack Dorsey.Conservatives are still allowed to share opinions.Yikes! This looks bad. Seems like the government may have to step in and take control. That always makes things better. 
'October 6th 2021',https://babylonbee.com/news/infrastructure-bill-includes-capitol-building-expansion-to-hold-all-the-pfizer-lobbyists,"Infrastructure Bill Includes Capitol Building Expansion To Hold All The Pfizer Lobbyists",WASHINGTON, D.C.—Senate leaders revealed today that Biden's "Build Back Better" infrastructure plan will include $86 Billion for a brand-new Capitol Building construction project. The Capitol will be expanded to hold 100 Senators, 435 Representatives, and 1,423 Pfizer lobbyists. "Better. Build blur, uh, der der trunalimunumaprzure," said Biden in a forceful speech defending the plan. "Derp rug abba loogey." A hand then appeared from behind a curtain and injected Biden with some sort of medication, causing Biden to come to his senses."These Pfizer people, they're good folks, folks! They know what they're doing! We're just gonna let them run the country for a while, I think. More time for me to watch Murder She Wrote on the television box!"Officials confirmed that to save time, the Biden administration plans to merge all regulatory agencies with Pfizer. They also confirmed that troops will arrive at your house tonight to administer your booster shot. Cool! 
'October 6th 2021',https://babylonbee.com/news/working-in-fast-food-would-be-humiliating-says-man-living-on-government-handouts,"'Working In Fast Food Would Be Humiliating,’ Says Man Living On Government Handouts",Brought to you by:MONROE, MI—Local man Chib Whimbly is casually looking for a job that will take him despite him having no useful qualifications whatsoever. Even though every fast food restaurant in the country is desperately begging for people, Whimbly—who lives in his parents' basement on unemployment assistance—says fast food would be beneath him."What I'm really looking for is a place that will pay at least 100K for me to record TikTok videos in my backyard," he said. "Fast food would be humiliating!" Experts have noted an epidemic of shameless people who would rather live a life of leisure collecting tax money from hard-working people—like some sort 18th-century foppish French aristocrat in a powdered wig—than suffer the indignity of a hard day's work. Whimbly is hoping to get back to work as soon as the right opportunity—preferably one that offers unlimited vacation and snacks—presents itself. NOT SATIRE: Careers don't sit still. The best know this and are always in opportunity mode. Join the Daily Job Hunt for daily tips, hype, and tons of exclusive member benefits. Free.
'October 6th 2021',https://babylonbee.com/news/local-man-prays-that-wifes-text-message-of-ok-really-means-ok,"Local Man Prays That Wife's Text Message Of 'OK' Really Means OK",UPLAND, CA—Local man Daniel Jackets prayed to the Lord yesterday afternoon that his wife's text message reading "OK" really meant "OK" and had no other deeper, hidden meaning he wasn't picking up on."Hey hon, gonna stay at work late and play some board games with the boys," he reportedly texted to her."OK," she replied."What does this mean, do you think, fellas?" he asked his coworkers, showing them the cryptic message. "The O, I get. The K, I get. Put it together, you get 'OK', so that should mean that I'm good to hang out with you guys, right? RIGHT?!"The group of male coworkers tried for hours to decipher the message but could not make heads or tails of it.Jackets guessed wrong. Please keep him in your prayers.
