Date,Link,Heading,Body
'October 14th 2021',https://babylonbee.com/news/boy-who-pointed-out-the-emperor-has-no-clothes-banned-for-misinformation,"Boy Who Pointed Out The Emperor Has No Clothes Banned For Misinformation",U.S.—Twitter, Facebook, YouTube, TikTok, and Instagram have all confirmed they have banned a young peasant child from their social networks after he pointed out that the emperor has no clothes.The brouhaha started after God-Emperor Joseph I showed off his new wardrobe at a press conference this morning. The press reported his fashion was "impeccable" and that he looked like an "even hotter George Clooney," but some far-right extremists said that he was actually naked."Is it just me, or is the emperor not wearing any clothes?" the boy posted on his social media accounts Thursday. Censors worked quickly, flagging his tweet with a warning that it was potentially harmful misinformation. Snopes fact-checked his claim and found that it was "mostly false," as the emperor was wearing socks. CNN dug into his old tweets and found that he tweeted that his best friend Castellan was a "booger head" two years ago.He made his case for the emperor actually being completely naked on his Parler account, prompting Amazon to immediately take down all of Parler. The IRS is also looking into his accounts as he had over 600 copper pieces in his satchel, and the FBI is going after him as he had a castle Lego set at his home, causing some to wonder if he was going to attack the emperor's castle and cause an insurrection.Meanwhile, the emperor, who is very old and mostly stays in the castle dungeon eating ice cream, had his spokesperson, Lady Jen Flocky, address the controversy. "Hear ye! Hear ye! The emperor is wearing the finest clothes, I assure you all," she said. "By his majesty's royal decree, anyone who says otherwise will be thrown into the alligator pit!"
'October 14th 2021',https://babylonbee.com/news/cat-rests-up-in-preparation-for-long-night-running-up-and-down-stairs,"Cat Rests Up In Preparation For Long Night Running Up And Down Stairs",MENIFEE, CA—Local unemployed cat Autumn got another good day's rest Thursday in preparation for a long evening running up and down the stairs at random times. "Sporadically running upstairs, and then downstairs, and then upstairs again to keep my humans awake is exhausting," Autumn told reporters, yawning, as she woke up from her seventh nap of the day. "It's not an easy job, but someone has to do it. Now, if you'll excuse me, I have to go meow by my food dish so my humans can move the food around and make it look like there's more food in there than there is." The cat says she is planning on some new moves today, including a few parkour tricks like jumping off the walls and kicking over a laundry basket and then fleeing through the house like a bat out of heck. Autumn has also filed a complaint of animal abuse against her owners for only holding the door open for her for seven hours at a time while she decides if she wants to go outside or stay inside.
'October 14th 2021',https://babylonbee.com/news/backed-up-cargo-ships-positioned-to-spell-out-lets-go-brandon,"Backed-Up Cargo Ships Positioned To Spell Out ‘Let’s Go Brandon’",PACIFIC OCEAN—With a tremendous backlog at Long Beach and dozens of cargo ships helplessly stranded in the ocean waiting to be unloaded, the bored crews have arranged their ships to form the words of the patriotic cheer taking the world by storm: "Let's Go Brandon." "Yeah, let's go Brandon!" said one ship's captain as he removed the cork from a bottle of mead and took a long, slow drink. "We here on the high seas often sing our sea shanties in his honor and pour out rum for such a swell guy.""SQUAWK! SUCH A SWELL GUY!" the parrot on his shoulder repeated.The captain said he and the other ship captains wanted to spell out a different phrase, but it was rated "ARRRRR".Experts who know what they're talking about say the catastrophic background has nothing to do with labor shortages due to vaccine mandates, or any policy related to President Biden and his highly competent Transportation Secretary Pete Buttigieg."Hey wow! Look at all those really big boats!" said Buttigieg while visiting the port. "Boats go vroooom! Pretty colors! I like the blue one!" He then went back home to play some Ticket to Ride and Mario Kart to help educate himself on more transportation-related issues.Longshoremen predict they will have the backlog fixed by 2028.
'October 14th 2021',https://babylonbee.com/news/adventurers-slay-giant-spiders-and-now-the-land-is-overrun-with-giant-flies,"Concerning Growth In Number Of Giant Flies As Adventurers Keep Slaying All The Giant Spiders",FORBIDDEN FOREST—It seemed a time for celebration: Adventurers encountered several giant spiders and slew them. But soon after, the whole land became overrun with bothersome giant flies.“This is why I hate adventurers,” said the unnamed man who runs the inn in the nearby town of Wolfwater. “They just see some ‘monsters’ and say, ‘Hey, maybe if I kill that, I’ll get some good experience, and perhaps it will drop some gold.’ And they never think of the long-term consequences.”“The giant ecosystem — though giant — is very fragile,” explained Professor Fizzle, who works in the library in Wolfwater. “Why do you think dungeons are overrun with giant rats? Because long ago, people killed all the giant cats.”Stormbreaker, one of the adventurers who was carrying an improbable sword nearly his own size, was unapologetic. “Those spiders attacked us when we were wandering the forest in search of the entrance to the Cave of Shadows,” he explained. “What was I supposed to do? Scoop them up in a giant cup?”It is unknown now whether the citizens of Wolfwater will need to import spiders from a neighboring region to restore balance to the ecosystem, or if the spiders will respawn if they just wait long enough.
'October 14th 2021',https://babylonbee.com/news/nfl-removes-all-coaches-players-fans-who-have-ever-said-a-bad-word-only-tim-tebow-remains,"NFL Removes All Coaches, Players, Fans Who Have Ever Said A Bad Word, Only Tim Tebow Remains",U.S.—Remember super-Christian and football/baseball player Tim Tebow? The guy who took a knee before it was cool? Well, Tebow is now officially the only member of the NFL. The bold change for the league occurred after officials decided that everyone who had ever said a bad word would be removed from the league.The entire NFL will just be an empty field with Tebow tossing a ball to himself with no spectators, coaches, teammates, opponents, or commentators, sources at the league confirmed today."Welp, I guess it's just Tim out there now," said Roger Goodell in his resignation speech. "I hope everyone enjoys watching him play. Well, I mean, you can't actually watch him because we've fired you as a fan for saying something off-color once. But Tim is a good kid. He'll have fun out there."Tebow took to the field for his first NFL game as the only member of the league Thursday evening, quietly took a knee and said a prayer, and then just went out there and tossed the ball around to himself. "I just want to thank my Lord and Savior Jesus Christ for blessing me with this opportunity," Tebow said. "And I want to thank the rest of the league for being heathens who said bad words in the past. I owe it all to you guys."Tebow still didn't score any touchdowns.
'October 14th 2021',https://babylonbee.com/news/irs-agents-parachute-into-7-year-olds-birthday-party-on-suspicion-he-got-more-than-600-worth-of-presents,"IRS Agents Bust 7-Year-Old For Getting More Than $600 Worth Of Birthday Presents",ASHEVILLE, NC—An elite platoon of airborne IRS agents parachuted into the Smithson’s backyard during little Sally’s 7th birthday party to enforce new requirements to track any financial transactions greater than $600.Agents immediately secured the party area by puncturing the bounce castle and flex-cuffing BoBo the Juggling Gorilla. They then proceeded to thoroughly catalog all the excess income collected by the new seven-year-old.Chief Airborne Auditor Alvin “Deduction Strangler” Clarke reviewed the agents’ findings. “Cash payments in the birthday cards alone easily approach the $600 threshold, even though Papa Earl and Gigi clearly tried to cheap out with a $15 McDonald’s gift card.”Clarke continued, “We also had a trampoline, several Barbies, and a few Lego sets, although we didn’t find the Millenium Falcon that Agent Glenn was really hoping to find for his kids. I mean for the evidence in the case. That’s right. A lot of the time I refer to evidence as ‘Agent Glenn’s kids.’ Why wouldn’t I?”Sally Smithson spent the rest of the day filling out complicated tax forms while the surrounding agents ate her cake and ice cream. “This is an important lesson for a young American to learn,” said Agent Clarke. “Remember, Sally, always check with the government before you do anything. And don’t forget to check that box about donating $1 to the presidential campaign fund. Support democracy!”
'October 14th 2021',https://babylonbee.com/news/dc-introduces-straight-christian-robin,"For Sake Of Diversity, DC Introduces Straight Christian Robin",BURBANK, CA—DC Comics recently announced on National Coming Out Day that the next iteration of Batman's faithful sidekick and boy wonder Robin will be coming out as a straight, cis-male fundamentalist Christian."We always knew Robin was gay," said writer Tom Taylor. "In fact, it's apparent that pretty much every DC superhero ever written has always been super gay. We thought it was time for a meaningful change to the Batman universe."To introduce some diversity to the almost 100% gay characters of DC, Robin will be rewritten as a faithful Baptist deacon from Indiana, who has a loving wife and 5 kids, and who fights crime in his spare time. He will also patrol universities to own the libs and shut down atheists. "Robin the Christian Boy Wonder will roam the streets of Gotham with his gay mentor Batman, sharing the good news of Jesus with street thugs and Arkham inmates," Taylor explained. "He is passionately pro-life, and even protests outside the abortion clinic from time to time. He'll also have some great catchphrases like 'Holy... is the Lord God Almighty, the whole earth is filled with his glory, Batman!' We've never had a character like this before."DC said they will be continuing to push inclusion in their comics by introducing some weak female characters to bring some more diversity to their lineup of strong female characters. 
'October 13th 2021',https://babylonbee.com/news/breaking-evil-mirror-universe-william-shatner-returns-from-space,"Breaking: Evil Mirror Universe William Shatner Returns From Space",On Wednesday, William Shatner, the beloved Boston Legal actor famous for portraying attorney Denny Crane, traveled to space.Shatner was one of four people aboard Jeff Bezos’s cucumber-shaped Blue Origin rocket as it soared to the edge of the atmosphere, offering breathtaking views and a few minutes of weightlessness. The shaft of the eggplant-shaped craft then detached and passengers floated back to earth. The mission seemed to be a success, but concerned witnesses said something about Shatner seemed off."He seemed…evil," said another crew member. "And he had a black goatee that really added to his evil look."After attempting to sabotage the next flight by removing the inertial dampeners and randomly attacking a civilian in a red shirt, Shatner declared that West Texas, where he landed, was “now part of the Terran Empire.” When Bezos attempted to congratulate him on his journey, Shatner cracked a bunch of bald jokes and mocked Bezos for being only the second richest person in the world.Experts theorize that somewhere in the lower atmosphere, the mushroom-shaped vessel encountered a disruption in the space/time continuum, and the William Shatner from our reality was replaced by a sinister William Shatner from a parallel timeline. Worst of all, the mirror Shatner is almost indistinguishable from our William Shatner, save his striking goatee and big, thick, evil eyebrows.Thankfully, the threat posed by evil William Shatner is predicted to be short-lived since, like the real William Shatner, he is 90 years old. Due to his age, he will probably return to the heavens soon, and this time not in a bratwurst-shaped spacecraft.
'October 13th 2021',https://babylonbee.com/news/8-great-uses-for-your-bible-since-you-never-take-the-time-to-read-it-you-heathen,"8 Other Uses For Your Bible Since We Know You're Not Reading It, You Sinner",Brought to you by:So you have this Bible in your house, but who's gonna read it? Not you, because you are a lazy, insolent heathen. We get it- you don't have enough time. Those 3-hour Joe Rogan podcasts won't listen to themselves. To keep your Bible from going to waste, here are 8 other great uses for it:#1) Coffeeshop Instagram photoshoot accessory: Take some artistic photos of your huge leather-bound Bible next to your morning coffee, add a sepia filter, and BOOM. Instant spirituality!#2) Carry it with you on airplanes so people won't try to talk to you: Works like a charm.#3) Leave it around the house in strategic places so your inconsiderate spouse can read it and maybe learn a few things: You may not need to read the Bible, but your spouse sure as heck does.#4) Use the maps in the back to plan your invasion of Canaan: It's worth considering. Apparently, they have milk and honey. #5) Gravity tester: Ever suddenly get worried gravity stopped working? Just hold up your Bible, let go, and make sure it falls to the ground. If it doesn’t... uh oh. Something’s wrong! #6) Discipline your cat: If your cat is acting up and scratching things, then make him read the Bible. Cats hate reading.#7) Hold it up for a photo-op after clearing out protesters with tear gas: This is an EPIC power move.#8) Fight off vampires: Are vampires trying to get into your house? Drop the Bible on their heads... but only if gravity is working.WAIT! This part isn't satire! In all seriousness, do you need to read your Bible more? Of course you do, you sinner. Try listening or reading along to God's Word using Dwell, the most creative Bible experience available in the App and Google Play Store. And get this! Dwell is giving all Babylon Bee readers free access to their app for 7 days, plus a coupon for 30% off. Get this exclusive deal now! 
'October 13th 2021',https://babylonbee.com/news/new-season-of-squid-game-will-have-giant-fauci-robot-detect-if-youre-not-wearing-a-mask-so-you-can-be-shot,"Next Season Of 'Squid Game' Will Have Giant Fauci Robot Shoot Anyone Who Doesn't Get Their Mask On In Time",SEOUL—The next season of Squid Game is in the works, and writers are upping the excitement. While the first season had a creepy little girl robot that would detect if you moved during "Red Light Green Light" so you could be shot, the new season will replace her with a giant Dr. Fauci robot who will flag you for death if you don't put on your mask."Red light!" Fauci will shout as players frantically scramble to get their mask out of their pockets and put it on. When he shouts "green light" and turns around, players are free to take off their mask and interact freely like normal humans. But he'll quickly turn around again, and if he catches you without your mask, you'll be shot on sight."No mask detected," the robot said in some early footage we've obtained from Netflix. "Human mouth, smile, and happiness recognized. Deploying snipers." Then, a gruesome sight: hundreds of people being gunned down in cold blood. The robot also has a glitch and some bugs to work out and just murders people with a MAGA hat, even if they're wearing a mask, according to showrunners.The next season of the series already has a 100% fresh rating on Rotten Tomatoes, raising concerns from normal people that it will be terrible.
'October 13th 2021',https://babylonbee.com/news/doctor-botches-abortion-child-tragically-born,"Doctor Botches Abortion, Child Tragically Born",NEW YORK, NY—In a devastating tragedy, a New York doctor botched an abortion procedure earlier this week, causing a healthy, happy baby boy to be born.The doctor had "serious problems" with his technique, according to hospital officials. His inexperience and negligence caused the women's health procedure to fail and the miracle of life to proceed uninhibited. While the doctor had performed this particular operation before, he reportedly failed to follow operating procedure and health guidelines for the abortion, causing the child to be tragically born."I'm so sorry," the doctor said, weeping, as the parents held their precious gift from God. "We tried everything we could. Sometimes, it just doesn't go our way." He buried his head in his hands and began weeping. "A new human has come into the world, and it's all because of me!"
'October 13th 2021',https://babylonbee.com/news/california-orders-police-to-arrest-children-who-pick-out-toys-traditionally-associated-with-their-biological-gender,"California Orders Police To Arrest Children Who Pick Out Toys Traditionally Associated With Their Biological Gender",SACRAMENTO, CA—California has ordered the immediate arrest of any children who pick out toys traditionally associated with their gender.Local police have been ordered by Sacramento to patrol toy stores and big box stores in order to find kids violating the new law stating that children must play with toys they do not like."Whether we're talking about a boy who picks out a Tonka truck or a girl who chooses a Barbie, we've ordered them to be arrested and taken into custody on sight," said Governor Gavin Newsom. "We don't want to shoot them, but we will if they resist by insisting on playing with their gendered toys.""All kids should enjoy just being genderless blobs with no preferences here in the progressive state of California.""DROP THE TONKA TRUCK AND PUT YOUR HANDS BEHIND YOUR HEAD!" shouted one officer as he saw a boy pick up a yellow dump truck from a Target store shelf in Sacramento. "DON'T MOVE PUNK!" The boy was taken into custody and sent to a gender reeducation camp to learn to do better, pick his new pronouns, and make license plates for Kamala Harris.Luckily for wayward kids, the law probably won't be in effect for very long, as every store in California is expected to move to Texas by the end of the year.
'October 13th 2021',https://babylonbee.com/news/santa-announces-that-due-to-supply-chain-issues-you-can-new-choose-between-a-roasted-chestnut-or-a-ball-in-a-cup,"Santa Announces That Due To Supply Chain Issues, You Can Now Choose Between A Roasted Chestnut Or A Ball-In-A-Cup",NORTH POLE—Jolly Saint Nick made a rare announcement from the North Pole this week to address crippling supply chain issues across the globe. According to Santa, supply constraints will limit everyone to two choices of Christmas present: a roasted chestnut, or a ball-in-a-cup. "Ho, ho, ho! It's not so bad!" said Santa in a recorded statement. "Have you ever had a delicious roasted chestnut? A classic Christmas gift from the days of yore! Delicious! And ball-in-a-cup? What a delightful amusement! Who needs a Playstation or iPhone when you have such a delightfully simple game that you can play with your friends while you develop your hand-eye coordination! Ho ho ho!"Santa then went off to cry alone in a corner.Elves assigned to manufacture this year's gifts proudly announced that the gifts will have many great features. For example, one chestnut can be combined with other chestnuts to create a delightful handful of chestnuts. The ball-in-a-cup will include a multiplayer component, enabling the user to stand in a room with other people playing ball-in-a-cup to play ball-in-a-cup. Wow!Santa said he is working hard to have a possible third gift offering ready for this year: t-shirts printed with the delightful holiday chant "Let's Go Brandon!"  
'October 13th 2021',https://babylonbee.com/news/fbi-assures-nation-they-will-get-back-to-figuring-out-why-that-guy-shot-400-people-in-vegas-after-theyre-done-investigating-parent-teacher-meetings,"FBI Assures Nation They Will Get Back To Figuring Out Why That Guy Shot 400 People In Vegas After They're Done Investigating Parent-Teacher Meetings",WASHINGTON, D.C.—The FBI has assured the nation that they will get back to figuring out why that guy shot 411 people in Las Vegas four years ago once they're finished investigating parent-teacher school board meetings across the country."Something more pressing than investigating the worst mass shooting in our nation's history has come up: parents concerned about what their kids are learning in school," said FBI agent Lars Conner as he donned a MAGA hat and sunglasses to infiltrate a parent-teacher meeting. "This is our top priority right now. Trying to figure out why a rando totally went rogue and fired thousands of rounds out a hotel window on concertgoers back in 2017 has to go on the backburner, for now.""What do you want us to do, just let parents have opinions unchecked? Not on my watch. We've gotta take these terrorists down."Indeed, sources within the FBI have confirmed that the FBI's most-wanted list is entirely parents at this point, from Cindy in Ohio to Amy in Wisconsin.At publishing time, the FBI had announced they will also "circle back" to BLM rioters, Antifa protesters, and Hunter Biden "after we've made sure these parents can't hurt school board members with their mean words anymore."
'October 12th 2021',https://babylonbee.com/news/biden-reassures-taiwan-chinese-invasion-is-just-part-of-the-process,"Biden Reassures Taiwan 'Invasion Is Just Part Of The Process'",WASHINGTON, D.C.—Amid a series of troublesome violations of Taiwan's air defence zone by China, President Biden took to the airwaves to address some of the concerns that the free country of Taiwan might be in danger of being invaded by the brutal Chinese communist state."Nothing to worry about folks, invasion is all part of the process. Happens all the time," said Biden. "If China invades Taiwan, we'll be sure to get everyone out of there, just like we did Afghanistan! And then we'll leave 80 billion dollars of weapons for the Chinese to use as sort of a housewarming gift. It's the least I can do for President Xi after he bought one of my son Hunter's paintings!"The press pool erupted into chaos as Biden was dragged offstage by aides. "The president was just kidding," said Psaki. "The U.S. will always remain true to our allies, and if we don't we'll just circle back to that later."When the press continued to shout questions, Psaki responded by diving out a window.President Xi announced that he can't wait to welcome back the people of Taiwan to the warm and loving embrace of Communism and then murder everyone.  
'October 12th 2021',https://babylonbee.com/news/kids-here-are-10-signs-your-parents-might-be-domestic-terrorists,"Kids, Here Are 10 Signs Your Parents Might Be Domestic Terrorists",Brought to you by:Hey! Are you a kid? Are you being raised by normal middle-class parents who love you and care for you? Uh-Oh, watch out! They may be dangerous domestic terrorists! It's important to keep a close eye on your parents for suspicious activity so you can report them to the FBI if necessary. Here are 10 troubling signs your parents may in fact be terrorists:1) They make you pray to Jesus instead of Dr. Fauci: This is a clear indication they are anti-science, since Fauci IS science, blessings be upon his name.2) They ask what you learned in school today: Asking this question shows that your parents don't trust the education experts who are forming your entire worldview. Just answer "nothing" and then call the authorities immediately!3) They say things like: "Let's threaten people and do violent domestic terrorism to them!": If they say this and they're not wearing a BLM t-shirt, it's a bad sign.  4) They require sunscreen when they go to the beach: This is clear evidence that your parents may be white. If they're white, they're automatically dangerous.5) They take away the pornographic queer theory book you borrowed in the school library: If they give you a wholesome Tuttle Twins book instead, it's bad news.6) They say racist dog whistles like "this school CRT curriculum seems pretty racist.": Absolutely disgusting.7) You have never seen them dress in drag at a local library: And if they've never encouraged you or any of your siblings to change genders, chances are they are dangerous transphobes.8) They don't have a verified blue check on Twitter: Gross. It probably means they work in unsophisticated jobs like plumbing or nursing which are hotbeds of violent domestic terror. 9) You can see their entire face when they talk: This means they aren't wearing a mask. They're basically murderers.10) They voted for Trump: The FBI is watching you from outside your door right now. If your parents voted for Trump, blink twice. They'll take it from there. Know the signs! And if you see something, say something!NOT SATIRE: Don't let the Biden administration, the FBI, or Cancel Culture win! Here is how the Tuttle Twins is fighting back:The Tuttle Twins children’s book series is teaching the rising generation about the ideas of freedom, free markets, individual responsibility, and American history.It costs roughly $10 to print and distribute one copy of the Tuttle Twins. Our goal is to raise $10,000 from Babylon Bee readers.Click here to help us distribute more copies of the Tuttle Twins books to schools across the country, with your tax-deductible gift of $10, $50, $100, $500, or even more.Thank you,Connor BoyackAuthor, Tuttle Twins   
